{
  "$id": "https://schemata.openattestation.com/io/tradetrust/certificate-of-origin/1.0",
  "$schema": "http://json-schema.org/draft-07/schema#",
  "type": "object",
  "title": "Description of data expected for certificate of origin documents",
  "required": [
    "supplyChainConsignment",
    "name",
    "firstSignatoryAuthentication",
    "secondSignatoryAuthentication",
    "issueLocation",
    "issuer",
    "status",
    "isPreferential",
    "freeTradeAgreement"
  ],
  "properties": {
    "supplyChainConsignment": {
      "type": "object",
      "properties": {
        "iD": {
          "type": "string"
        },
        "information": {
          "type": "string"
        },
        "exportCountry": {
          "type": "object",
          "properties": {
            "code": {
              "type": "string"
            }
          }
        },
        "exporter": {
          "type": "object",
          "properties": {
            "iD": {
              "type": "string"
            },
            "name": {
              "type": "string"
            },
            "postalAddress": {
              "type": "object",
              "properties": {
                "line1": {
                  "type": "string"
                },
                "line2": {
                  "type": "string"
                },
                "cityName": {
                  "type": "string"
                },
                "postcode": {
                  "type": "string"
                },
                "countrySubDivisionName": {
                  "type": "string"
                },
                "countryCode": {
                  "type": "string"
                }
              }
            }
          }
        },
        "importCountry": {
          "type": "object",
          "properties": {
            "code": {
              "type": "string"
            }
          }
        },
        "importer": {
          "type": "object",
          "properties": {
            "iD": {
              "type": "string"
            },
            "name": {
              "type": "string"
            },
            "postalAddress": {
              "type": "object",
              "properties": {
                "line1": {
                  "type": "string"
                },
                "line2": {
                  "type": "string"
                },
                "cityName": {
                  "type": "string"
                },
                "postcode": {
                  "type": "string"
                },
                "countrySubDivisionName": {
                  "type": "string"
                },
                "countryCode": {
                  "type": "string"
                }
              }
            }
          }
        },
        "includedConsignmentItems": {
          "type": "array",
          "items": {
            "type": "object",
            "properties": {
              "iD": {
                "type": "string"
              },
              "information": {
                "type": "string"
              },
              "crossBorderRegulatoryProcedure": {
                "type": "object",
                "properties": {
                  "originCriteriaText": {
                    "type": "string"
                  }
                }
              },
              "manufacturer": {
                "type": "object",
                "properties": {
                  "iD": {
                    "type": "string"
                  },
                  "name": {
                    "type": "string"
                  },
                  "postalAddress": {
                    "type": "object",
                    "properties": {
                      "line1": {
                        "type": "string"
                      },
                      "line2": {
                        "type": "string"
                      },
                      "cityName": {
                        "type": "string"
                      },
                      "postcode": {
                        "type": "string"
                      },
                      "countrySubDivisionName": {
                        "type": "string"
                      },
                      "countryCode": {
                        "type": "string"
                      }
                    }
                  }
                }
              },
              "tradeLineItems": {
                "type": "array",
                "items": {
                  "type": "object",
                  "properties": {
                    "sequenceNumber": {
                      "type": "integer"
                    },
                    "invoiceReference": {
                      "type": "object",
                      "properties": {
                        "iD": {
                          "type": "string"
                        },
                        "formattedIssueDateTime": {
                          "type": "string"
                        },
                        "attachedBinaryFile": {
                          "type": "object",
                          "properties": {
                            "uRI": {
                              "type": "string"
                            }
                          }
                        }
                      }
                    },
                    "tradeProduct": {
                      "type": "object",
                      "properties": {
                        "iD": {
                          "type": "string"
                        },
                        "description": {
                          "type": "string"
                        },
                        "harmonisedTariffCode": {
                          "type": "object",
                          "properties": {
                            "classCode": {
                              "type": "string"
                            },
                            "className": {
                              "type": "string"
                            }
                          }
                        },
                        "originCountry": {
                          "type": "object",
                          "properties": {
                            "code": {
                              "type": "string"
                            }
                          }
                        }
                      }
                    },
                    "transportPackages": {
                      "type": "array",
                      "items": {
                        "type": "object",
                        "properties": {
                          "iD": {
                            "type": "string"
                          },
                          "grossVolume": {
                            "type": "string"
                          },
                          "grossWeight": {
                            "type": "string"
                          }
                        }
                      }
                    }
                  }
                }
              }
            }
          }
        },
        "loadingBaseportLocation": {
          "type": "object",
          "properties": {
            "iD": {
              "type": "string"
            },
            "name": {
              "type": "string"
            }
          }
        },
        "mainCarriageTransportMovement": {
          "type": "object",
          "properties": {
            "iD": {
              "type": "string"
            },
            "information": {
              "type": "string"
            },
            "usedTransportMeans": {
              "type": "object",
              "properties": {
                "name": {
                  "type": "string"
                },
                "iD": {
                  "type": "string"
                }
              }
            },
            "departureEvent": {
              "type": "object",
              "properties": {
                "departureDateTime": {
                  "type": "string"
                }
              }
            }
          }
        },
        "unloadingBaseportLocation": {
          "type": "object",
          "properties": {
            "iD": {
              "type": "string"
            },
            "name": {
              "type": "string"
            }
          }
        }
      }
    },
    "name": {
      "type": "string",
      "description": "Certificate of Origin name",
      "examples": ["CHAFTA Certificate of Origin"]
    },
    "firstSignatoryAuthentication": {
      "type": "object",
      "properties": {
        "signature": {
          "type": "string"
        },
        "actualDateTime": {
          "type": "string"
        },
        "statement": {
          "type": "string"
        }
      }
    },
    "secondSignatoryAuthentication": {
      "type": "object",
      "properties": {
        "signature": {
          "type": "string"
        },
        "actualDateTime": {
          "type": "string"
        },
        "statement": {
          "type": "string"
        }
      }
    },
    "issueLocation": {
      "iD": {
        "type": "string"
      },
      "name": {
        "type": "string"
      }
    },
    "issuer": {
      "iD": {
        "type": "string"
      },
      "name": {
        "type": "string"
      },
      "postalAddress": {
        "type": "object",
        "properties": {
          "line1": {
            "type": "string"
          },
          "line2": {
            "type": "string"
          },
          "cityName": {
            "type": "string"
          },
          "postcode": {
            "type": "string"
          },
          "countrySubDivisionName": {
            "type": "string"
          },
          "countryCode": {
            "type": "string"
          }
        }
      }
    },
    "status": {
      "type": "string"
    },
    "isPreferential": {
      "type": "boolean"
    },
    "freeTradeAgreement": {
      "type": "string"
    }
  }
}
