{
  "supplyChainConsignment": {
    "exportCountry": {},
    "exporter": {
      "postalAddress": {}
    },
    "importCountry": {},
    "importer": {
      "postalAddress": {}
    },
    "loadingBaseportLocation": {},
    "mainCarriageTransportMovement": {
      "usedTransportMeans": {},
      "departureEvent": {}
    },
    "unloadingBaseportLocation": {}
  },
  "name": "CHAFTA Certificate of Origin",
  "firstSignatoryAuthentication": {
    "signature": "Signature",
    "actualDateTime": "2020-05-29T09:46:34Z",
    "statement": "The undersigned hereby declares that the above-stated information is correct and that the goods exported to [importer] comply with the origin requirements specified in the China-Australia Free Trade Agreement."
  },
  "secondSignatoryAuthentication": {
    "signature": "Signature",
    "actualDateTime": "2020-06-03T03:50:45Z",
    "statement": "On the basis of the control carried out, it is hereby certified that the information herein is correct and that the described goods comply with the origin requirements of the China-Australia Free Trade Agreement."
  },
  "issueLocation": {
    "iD": "unece.un.org:locode:AUADL",
    "name": "Adelaide"
  },
  "issuer": {
    "iD": "id:wfa.org.au",
    "name": "Australian Grape and Wine Incorporated",
    "postalAddress": {
      "line1": "Level 1, Industry Offcies",
      "line2": "Botanic Road",
      "cityName": "Adelaide",
      "postcode": "5000",
      "countrySubDivisionName": "SA",
      "countryCode": "AU"
    }
  },
  "status": "issued",
  "isPreferential": true,
  "freeTradeAgreement": "CHAFTA"
}
